{
  "fact_id": "018f0a40-0002-7002-8002-000000000002",
  "correlation_id": "018f0a10-2222-7222-8222-222222220001",
  "observed_at": "2026-07-20T14:32:05.123Z",
  "kind": "MEDIA_QUALITY",
  "subject_ref": "stream:018f0a40-0023-7023-8023-000000000023",
  "detail": {
    "mos": 4.2,
    "jitter_ms": 9.0,
    "packet_loss": 0.0,
    "latency_ms": 24.0
  }
}
